Marco Antonio Hidrogo Ordaz,"Hidrogo Ordaz,Marco Antonio",3,,,,,,"Gómez Palacio, MX",2017 - 2020,2017,2020,2.0,HOMBRE,LICENCIATURA EN INGENIERÍA ELECTRÓNICA,INSTITUTO TECNOLÓGICO DE LA LAGUNA ,1.0,9368132,2015.0,,,,,,,,,0.0,YANFENG,ADVANCE PROCESS ENGINEER,Mexicana
Marco Sanchez,"Sanchez,Marco",3,,,,,,"Mexico City, MX",1991 - 2024,1991,2024,,Hombre,,,,,,,,,,,,,,,,,
Marcos Ahuizotl Fragoso Iniguez,"Fragoso Iniguez,Marcos Ahuizotl",3,,,,,,"Unión y Progreso, MX",2018 - 2024,2018,2024,3.0,HOMBRE,LICENCIATURA EN INGENIERÍA EN MECATRÓNICA,INSTITUTO POLITÉCNICO NACIONAL,1.0,8967624,2015.0,,,,,,,,,0.0,FORD MOTOR COMPANY,SIX SIGMA BLACK BELT,Mexicana
Maria del Mar Cepeda Garcia,"Cepeda Garcia,Maria del Mar",3,,,,,,"Xico, MX",2007 - 2009,2007,2009,5.0,MUJER,LICENCIATURA EN INGENIERÍA MECÁNICA Y EN SISTEMAS ENERGÉTICOS,UNIVERSIDAD LA SALLE,0.0,3728362,2002.0,,,,,,,,,0.0,,,Mexicana
Maria del Pilar Arzola Garcia,"Arzola Garcia,Maria del Pilar",3,,,,,,"Mexico City, MX",2016 - 2021,2016,2021,18.0,MUJER,LICENCIATURA EN INGENIERÍA QUÍMICA,UNIVERSIDAD NACIONAL AUTÓNOMA DE MÉXICO,1.0,2632924,1998.0,,,,,,,,,0.0,,,Mexicana
Maria Elena Vazquez,"Elena Vazquez,Maria",3,,,,,,"Guadalajara, MX",2009 - 2011,2009,2011,,Mujer,,,,,,,,,,,,,,,,,
Maria Fernanda Pulido Plauchud,"Pulido Plauchud,Maria Fernanda",3,,,,,,"Toluca, MX",2017 - 2022,2017,2022,4.0,MUJER,LICENCIATURA EN DISEÑO INDUSTRIAL,UNIVERSIDAD IBEROAMERICANA,0.0,8401186,2013.0,MAESTRÍA EN TECNOLOGÍA E INOVACIÓN,UNIVERSIDAD IBEROAMERICANA,,2017,,,,,1.0,ALSTOM,PRODUCT ENGINEERING MANAGER,Mexicana
Maria Fernandez Trevino,"Fernandez Trevino,Maria",3,,,,,,"Monterrey, MX",2013 - 2020,2013,2020,,Mujer,,,,,,,,,,,,,,,,,
Maria Gonzalez,"Gonzalez,Maria",3,,,,,,"Coyoacán, MX",2017 - 2019,2017,2019,,Mujer,,,,,,,,,,,,,,,,,
Maria Nohemi Bravo Solis,"Bravo Solis,Maria Nohemi",3,,,,,,"Tlaquepaque, MX",2017 - 2019,2017,2019,-2.0,MUJER,LICENCIATURA EN INGENIERÍA FÍSICA,UNIVERSIDAD DE GUANAJUATO,1.0,11517299,2019.0,,,,,,,,,0.0,,,Mexicana
Maria Teresa Guerra Reyes,"Teresa Guerra Reyes,Maria",3,,,,,,"El Control, MX",1993 - 2005,1993,2005,1.0,MUJER,LICENCIATURA COMO INGENIERÍA QUÍMICA Y DE SISTEMAS,INSTITUTO TECNOLÓGICO Y DE ESTUDIOS SUPERIORES DE MONTERREY,0.0,1686129,1992.0,,,,,,,,,0.0,,,Mexicana
Maria Teresa Mata Gonzalez,"Teresa Mata Gonzalez,Maria",3,,,,,,"Copoya, MX",2013 - 2017,2013,2017,16.0,MUJER,LICENCIATURA EN BIOLOGÍA EXPERIMENTAL,UNIVERSIDAD AUTÓNOMA METROPOLITANA,1.0,2440661,1997.0,MAESTRÍA EN BIOLOGÍA EXPERIMENTAL,UNIVERSIDAD AUTÓNOMA METROPOLITANA,5007306,2007,DOCTORADO EN CIENCIAS EN BIOMEDICINA MOLECULAR,CENTRO DE INVESTIGACIÓN Y DE ESTUDIOS AVANZADOS DE,5007307,2007,1.0,Laboratorios Silanes S.A. de C.V.,Coordinador de proyectos biotecnológicos,Mexicana
Mario Alejandro Medina Huerta,"Medina Huerta,Mario Alejandro",3,,,,,,"Mexico City, MX",2019 - 2019,2019,2019,2.0,HOMBRE,LICENCIATURA EN INGENIERÍA MECATRÓNICA,INSTITUTO POLITÉCNICO NACIONAL,1.0,10231236,2017.0,,,,,,,,,0.0,Ford Motor Company,Product Development Engineer,Mexicana
Mario Contreras Sosa,"Contreras Sosa,Mario",3,,,,,,"Naucalpan, MX",2019 - 2023,2019,2023,11.0,HOMBRE,LICENCIATURA EN INGENIERÍA MECATRÓNICA,INSTITUTO TECNOLÓGICO Y DE ESTUDIOS SUPERIORES DE MONTERREY,0.0,5585244,2008.0,,,,,,,,,0.0,,,Mexicana
Mario Garcia Lannoy,"Garcia Lannoy,Mario",3,,,,,,"Toluca, MX",2015 - 2018,2015,2018,9.0,HOMBRE,LICENCIATURA EN INGENIERÍA MECÁNICA,UNIVERSIDAD TECNOLÓGICA DE MÉXICO,0.0,4875397,2006.0,,,,,,,,,0.0,INTEVA PRODUCTS,INGENIERÍA MECÁNICA,Mexicana
Mario Sergio Sandate Aguilar,"Sandate Aguilar,Mario Sergio",3,,,,,,"Reynosa, MX",2015 - 2019,2015,2019,,Hombre,,,,,,,,,,,,,,,,,
Martin Zamorano Fragoso,"Zamorano Fragoso,Martin",3,,,,,,"Ciudad Juárez, MX",2021 - 2023,2021,2023,23.0,HOMBRE,LICENCIATURA EN INGENIERÍA INDUSTRIAL,INSTITUTO TECNOLÓGICO DE PACHUCA (I.T.R.),1.0,2780611,1998.0,,,,,,,,,0.0,,,Mexicana
Mauricio de la Garza,"la Garza,Mauricio de",3,,,,,,"Monterrey, MX",2016 - 2022,2016,2022,,Hombre,,,,,,,,,,,,,,,,,
Mauricio Enrique Ferrusca Ceja,"Ferrusca Ceja,Mauricio Enrique",3,,,,,,"Mexico City, MX",2011 - 2013,2011,2013,,Hombre,,,,,,,,,,,,,,,,,
Mauricio Javier Gutierrez Romero,"Gutierrez Romero,Mauricio Javier",3,,,,,,"San Pedro Garza García, MX",2016 - 2021,2016,2021,10.0,HOMBRE,LICENCIATURA EN INGENIERÍA CIVIL,INSTITUTO TECNOLÓGICO Y DE ESTUDIOS SUPERIORES DE MONTERREY,0.0,4828443,2006.0,,,,,,,,,0.0,,,Mexicana
Mauricio Zambrano,"Zambrano,Mauricio",3,,,,,,"Apodaca, MX",2017 - 2023,2017,2023,,Hombre,,,,,,,,,,,,,,,,,
Michelle Carolina Herrera Gutierrez,"Herrera Gutierrez,Michelle Carolina",3,,,,,,"Mexico City, MX",2019 - 2024,2019,2024,6.0,MUJER,LICENCIATURA EN INGENIERÍA EN MECATRÓNICA,INSTITUTO TECNOLÓGICO Y DE ESTUDIOS SUPERIORES DE MONTERREY,0.0,8275082,2013.0,,,,,,,,,0.0,,,Mexicana
Miguel Arias Estrada,"Arias Estrada,Miguel",3,,,,,,"San Pedro Cholula, MX",2001 - 2012,2001,2012,,Hombre,,,,,,,,,,,,,,,,,
Miguel Arroyo Ortega,"Arroyo Ortega,Miguel",3,,,,,,"Guadalupe, MX",2014 - 2022,2014,2022,,Hombre,,,,,,,,,,,,,,,,,
Miguel Bernal Marin,"Bernal Marin,Miguel",3,,,,,,"Zapopan, MX",2020 - 2022,2020,2022,0.0,HOMBRE,LICENCIATURA EN MATEMÁTICAS,UNIVERSIDAD DE GUADALAJARA,1.0,12060494,2020.0,MAESTRÍA EN CIENCIAS EN LA ESPECIALIDAD DE INGENIERÍA ELÉCTRICA,CENTRO DE INVESTIGACIÓN Y DE ESTUDIOS AVANZADOS DEL IPN ,13018086,2022,DOCTORADO EN CIENCIAS EN LA ESPECIALIDAD DE INGENIERÍA ELÉCTRICA,CENTRO DE INVESTIGACIÓN Y DE ESTUDIOS AVANZADOS DEL IPN ,13087840,2022,1.0,INTEL CORPORATION,OS DEVELOPMENT ENGINEER,Mexicana
Miguel Bravo Zanoguera,"Bravo Zanoguera,Miguel",3,,,,,,"Mexicali, MX",1999 - 2009,1999,2009,,Hombre,,,,,,,,,,,,,,,,,
Miguel Camargo Soto,"Camargo Soto,Miguel",3,,,,,,"Mexicali, MX",2022 - 2023,2022,2023,4.0,HOMBRE,LICENCIATURA EN INGENIERÍA EN ELECTRÓNICA,UNIVERSIDAD AUTÓNOMA DE BAJA CALIFORNIA,1.0,11455707,2018.0,,,,,,,,,0.0,,,Mexicana
Miguel E Madero O'Brien,"Madero O'Brien,Miguel E",3,,,,,,"Mexico City, MX",2007 - 2012,2007,2012,,Hombre,,,,,,,,,,,,,,,,,
Miguel F Escobar,"F Escobar,Miguel",3,,,,,,"Abdenago C. García (Lagunitas), MX",2014 - 2016,2014,2016,,Hombre,,,,,,,,,,,,,,,,,
Miguel Hernandez,"Hernandez,Miguel",3,,,,,,"San Luis Potosí, MX",2014 - 2015,2014,2015,,Hombre,,,,,,,,,,,,,,,,,
Miguel Morfin Diaz,"Morfin Diaz,Miguel",3,,,,,,"Irapuato, MX",2014 - 2016,2014,2016,15.0,HOMBRE,LICENCIATURA EN INGENIERÍA INDUSTRIAL MECÁNICA,INSTITUTO TECNOLÓGICO DE CIUDAD GUZMÁN,1.0,2965334,1999.0,,,,,,,,,0.0,,,Mexicana
Mike Appleby,"Appleby,Mike",3,,,,,,"Guadalajara, MX",2017 - 2022,2017,2022,,Hombre,,,,,,,,,,,,,,,,,
Mikhail G Shlyagin,"G Shlyagin,Mikhail",3,,,,,,"Ensenada, MX",2004 - 2006,2004,2006,,,,,,,,,,,,,,,,,,,
Minerva Nieto Torres,"Nieto Torres,Minerva",3,,,,,,"Mexico City, MX",2021 - 2022,2021,2022,16.0,MUJER,LICENCIATURA EN INGENIERÍA INDUSTRIAL Y DE SISTEMAS,INSTITUTO TECNOLÓGICO Y DE ESTUDIOS SUPERIORES DE MONTERREY,0.0,4506048,2005.0,MAESTRÍA EN ADMINISTRACIÓN,UNIVERSIDAD DEL VALLE DE MÉXICO,6174066,2009,,,,,1.0,,,Mexicana
Moises Lopez,"Lopez,Moises",3,,,,,,"Xico, MX",2004 - 2011,2004,2011,,Hombre,,,,,,,,,,,,,,,,,
Monica Mendoza,"Mendoza,Monica",3,,,,,,"Puebla, MX",2022 - 2023,2022,2023,,Mujer,,,,,,,,,,,,,,,,,
Nathali Vasquez Henao,"Vasquez Henao,Nathali",3,,,,,,"Mexico City, MX",2019 - 2019,2019,2019,3.0,MUJER,LICENCIATURA EN INGENIERO EN MECATRÓNICA,INSTITUTO TECNOLÓGICO Y DE ESTUDIOS SUPERIORES DE MONTERREY,0.0,10002403,2016.0,,,,,,,,,0.0,,,Mexicana
Nicole Pamela Herrera Gutierrez,"Fernandez de Castro,Daniel Vogel",3,,,,,,"Mexico City, MX",2018 - 2019,2018,2019,3.0,MUJER,LICENCIATURA EN INGENIERO EN MECATRÓNICA,INSTITUTO TECNOLÓGICO Y DE ESTUDIOS SUPERIORES DE MONTERREY,0.0,9639261,2015.0,,,,,,,,,0.0,FORD MOTOR COMPANY,INTEGRADORA DE SISTEMAS,Mexicana
Norma Araceli Garcia Munoz,"Garcia Munoz,Norma Araceli",3,,,,,,"Mexico City, MX",2014 - 2021,2014,2021,14.0,MUJER,LICENCIATURA COMO INGENIERO PETROLERO ,UNIVERSIDAD AUTÓNOMA DE MÉXICO ,1.0,3076006,2000.0,MAESTRÍA EN INGENIERÍA PETROLERA,UNIVERSIDAD NACIONAL AUTÓNOMA DE MÉXICO ,3862992,2004,,,,,1.0,INSTITUTO MEXICANO DEL PETRÓLEO,LÍDER DE PROYECTO,Mexicana
Octavio Beltran Salinas,"Beltran Salinas,Octavio",3,,,,,,"Reynosa, MX",2009 - 2018,2009,2018,,Hombre,,,,,,,,,,,,,,,,,
Octavio Parra Tabla,"Parra Tabla,Octavio",3,,,,,,"Querétaro, MX",1999 - 2015,1999,2015,11.0,HOMBRE,LICENCIATURA COMO QUÍMICO INDUSTRIAL,BENEMÉRITA UNIVERSIDAD AUTÓNOMA DE PUEBLA,1.0,1223048,1988.0,,,,,,,,,0.0,,,Mexicana
Ola Lantz,"Lantz,Ola",3,,,,,,"Rayón, MX",2021 - 2022,2021,2022,,,,,,,,,,,,,,,,,,,
Omar Antonio Ramirez,"Antonio Ramirez,Omar",3,,,,,,"Querétaro, MX",2017 - 2024,2017,2024,,Hombre,,,,,,,,,,,,,,,,,
Omar Rene Hernandez Sanchez,"Hernandez Sanchez,Omar Rene",3,,,,,,"Toluca, MX",2018 - 2020,2018,2020,5.0,HOMBRE,LICENCIATURA EN DISEÑO INDUSTRIAL,UNIVERSIDAD AUTÓNOMA DEL ESTADO DE MÉXICO,1.0,7923740,2013.0,,,,,,,,,0.0,GENERAL MOTORS,DESIGN ENGINEER,Mexicana
Omar Yuren Mendoza Bravo,"Mendoza Bravo,Omar Yuren",3,,,,,,"Cuautitlán Izcalli, MX",2017 - 2023,2017,2023,8.0,HOMBRE,LICENCIATURA EN INGENIERÍA MECÁNICA,INSTITUTO TECNOLÓGICO DE VERACRUZ (I.T.R.),1.0,5765433,2009.0,MAESTRÍA EN INGENIERÍA,UNIVERSIDAD NACIONAL AUTÓNOMA DE MÉXICO,6919836,2011,,,,,1.0,,,Mexicana
Orlando Santillan Godinez,"Santillan Godinez,Orlando",3,,,,,,"Ticumán, MX",2021 - 2023,2021,2023,14.0,HOMBRE,LICENCIATURA EN CIENCIAS GENÓMICAS,UNIVERSIDAD NACIONAL AUTÓNOMA DE MÉXICO,1.0,5348402,2007.0,,,,,,,,,0.0,CAS Biotechnology,Researcher,Mexicana
Oscar Alvarez,"Alvarez,Oscar",3,,,,,,"Mexicali, MX",2011 - 2019,2011,2019,,Hombre,,,,,,,,,,,,,,,,,
Oscar Hernandez Cervantes,"Hernandez Cervantes,Oscar",3,,,,,,"Santiago Yancuitlalpan, MX",2018 - 2019,2018,2019,,Hombre,,,,,,,,,,,,,,,,,
Oscar Saavedra,"Saavedra,Oscar",3,,,,,,"Toluca, MX",2018 - 2020,2018,2020,,Hombre,,,,,,,,,,,,,,,,,
Pablo Alejandro del Angel Marrufo,"del Angel Marrufo,Pablo Alejandro",3,,,,,,"Monterrey, MX",2015 - 2019,2015,2019,1.0,HOMBRE,LICENCIATURA EN DISEÑO INDUSTRIAL,UNIVERSIDAD AUTÓNOMA DE NUEVO LEÓN,1.0,8546121,2014.0,,,,,,,,,0.0,,,Mexicana
Pablo Daniel Molina Cardozo,"Molina Cardozo,Pablo Daniel",3,,,,,,"Toluca, MX",2020 - 2022,2020,2022,4.0,HOMBRE,LICENCIATURA EN INGENIERÍA MECATRÓNICA,INSTITUTO TECNOLÓGICO Y DE ESTUDIOS SUPERIORES DE MONTERREY,0.0,10002399,2016.0,,,,,,,,,0.0,,,Mexicana
Pablo Gomez,"Gomez,Pablo",3,,,,,,"Chihuahua, MX",2015 - 2023,2015,2023,,Hombre,,,,,,,,,,,,,,,,,
Pablo Vidales,"Vidales,Pablo",3,,,,,,"Naucalpan, MX",2012 - 2014,2012,2014,,Hombre,,,,,,,,,,,,,,,,,
Pablo Enrique Duarte Escareno,"Duarte Escareno,Pablo Enrique",3,,,,,,"Monterrey, MX",2006 - 2015,2006,2015,,Hombre,,,,,,,,,,,,,,,,,
Patricia Luevano,"Luevano,Patricia",3,,,,,,"Izamal, MX",2019 - 2021,2019,2021,,Mujer,,,,,,,,,,,,,,,,,
Patricia Luevano Gonzalez,"Luevano Gonzalez,Patricia",3,,,,,,"Izamal, MX",2018 - 2021,2018,2021,11.0,MUJER,LICENCIATURA EN DISEÑO,UNIVERSIDAD ANÁHUAC,0.0,5058807,2007.0,MAESTRÍA EN INNOVACIÓN PARA EL DESARROLLO EMPRESARIAL,INSTITUTO TECNOLÓGICO Y DE ESTUDIOS SUPERIORES DE MONTERREY,8881714,2014,,,,,1.0,Universidad La Salle Chihuahua,Profesora Investigadora,Mexicana
Patricia Olguin Lora,"Olguin Lora,Patricia",3,,,,,,"Mexico City, MX",2014 - 2019,2014,2019,25.0,MUJER,LICENCIATURA EN INGENIERÍA DE LOS ALIMENTOS,UNIVERSIDAD AUTÓNOMA METROPOLITANA,1.0,1329183,1989.0,MAESTRÍA EN BIOTECNOLOGÍA ,UNIVERSIDAD AUTÓNOMA METROPOLITANA,,,DOCTORADO EN CIENCIAS QUÍMICAS,UNIVERSITE DE RENNES ,,1999,1.0,INSTITUTO MEXICANO DEL PETRÓLEO,INVESTIGADOR CIENTÍFICO,Mexicana
Pedro Montoya,"Montoya,Pedro",3,,,,,,"Mexico City, MX",2019 - 2020,2019,2020,,Hombre,,,,,,,,,,,,,,,,,
Pedro Yabur Pacheco,"Yabur Pacheco,Pedro",3,,,,,,"Saltillo, MX",2019 - 2020,2019,2020,26.0,HOMBRE,LICENCIATURA EN DISEÑO INDUSTRIAL,UNIVERSIDAD AUTÓNOMA METROPOLITANA,1.0,1810476,1993.0,,,,,,,,,0.0,,,Mexicana
Philippe Leff Gelman,"Leff Gelman,Philippe",3,,,,,,"Mexico City, MX",2011 - 2014,2011,2014,,Hombre,,,,,,,,,,DOCTORADO EN CIANCIAS MÉDICAS,INSTITUTO POLITÉCNICO NACIONAL,,2006,1.0,INSTITUTOS NACIONALES DE SALUD MEXICO,INVESTIGADOR EN CIENCIAS MEDICAS,
Rafael Avalos Guzman,"Avalos Guzman,Rafael",3,,,,,,"San Mateo del Mar, MX",1999 - 2013,1999,2013,17.0,HOMBRE,LICENCIATURA EN INGENIERÍA METALURGISTA,INSTITUTO POLITÉCNICO NACIONAL,1.0,724916,1982.0,,,,,,,,,0.0,,,Mexicana
Rafael Valadez Castillo,"Valadez Castillo,Rafael",3,,,,,,"San Mateo del Mar, MX",2004 - 2006,2004,2006,,Hombre,,,,,,,,,,,,,,,,,
Ramon Alberto Aguilar Armendariz,"Aguilar Armendariz,Ramon Alberto",3,,,,,,"Veracruz, MX",1996 - 2016,1996,2016,,Hombre,,,,,,,,,,,,,,,,,
Ramon Oswaldo G Medina,"G Medina,Ramon Oswaldo",3,,,,,,"Tecalitlán, MX",2019 - 2021,2019,2021,,Hombre,,,,,,,,,,,,,,,,,
Ramon PARRA MICHEL,"PARRA MICHEL,Ramon",3,,,,,,"Jalisco, MX",2021 - 2021,2021,2021,13.0,HOMBRE,LICENCIATURA EN INGENIERÍA MECÁNICA ELECTRICISTA,UNIVERSIDAD DE GUADALAJARA,1.0,5384881,2008.0,,,,,,,,,0.0,CINVESTAV,PROFESOR/INVESTIGADOR,Mexicana
Ramses Galaz Mendez,"Galaz Mendez,Ramses",3,,,,,,"Hermosillo, MX",2016 - 2019,2016,2019,17.0,HOMBRE,LICENCIATURA COMO INGENIERO MECÁNICO ADMINISTRADOR,INSTITUTO TECNOLÓGICO Y DE ESTUDIOS SUPERIORES DE MONTERREY,0.0,2996499,1999.0,MAESTRÍA EN INGENIERÍA MECÁNICA,MCGILL UNIVERSITY,,2004,DOCTORADO EN INGENIERÍA BIOMÉDICA,MCGILL UNIVERSITY,,2009,1.0,GSE BIOMEDICAL,CHIEF EXECUTIVE OFFICER,Mexicana
Raul Caballero,"Caballero,Raul",3,,,,,,"Mexico City, MX",1988 - 2017,1988,2017,,Hombre,,,,,,,,,,,,,,,,,
Raul Campogarrido,"Campogarrido,Raul",3,2.0,BOEHRINGER INGELHEIM VETMEDICA S.A. DE C.V.,3,2,1,"Jalisco, MX",2009 - 2011,2009,2011,,Hombre,,,,,,,,,,,,,,,,,
Raul Dominguez Palestino,"Dominguez Palestino,Raul",3,0.0,"TIMSER, S.A.P.I. DE C.V.",2,0,0,"Mexico City, MX",2021 - 2023,2021,2023,1.0,HOMBRE,LICENCIATURA EN CIENCIAS GENÓMICAS,UNIVERSIDAD NACIONAL AUTÓNOMA DE MÉXICO,1.0,12021140,2020.0,,,,,,,,,0.0,,,Mexicana
Raul G Enriquez,"G Enriquez,Raul",3,46.0,Universidad Tecnica Particular De Loja,15,0,2,"Coyoacán, MX",1993 - 2019,1993,2019,,Hombre,,,,,,,,,,,,,,,,,
Raul Navarro Mascarell,"Navarro Mascarell,Raul",3,2.0,M-I L.L.C.,2,0,2,"Celaya, MX",2014 - 2019,2014,2019,12.0,HOMBRE,LICENCIATURA EN INGENIERÍA QUÍMICA ADMINISTRADOR,INSTITUTO TECNOLÓGICO Y DE ESTUDIOS SUPERIORES DE MONTERREY,0.0,3733395,2002.0,,,,,,,,,0.0,,,Mexicana
Ricardo Abraham De La Cruz Cordero,"De La Cruz Cordero,Ricardo Abraham",3,2.0,Nucitec S.A. de C.V.,8,1,0,"Huixtla, MX",2012 - 2016,2012,2016,15.0,HOMBRE,LICENCIATURA COMO QUÍMICO FARMACOBIÓLOGO,UNIVERSIDAD AUTÓNOMA DE CHIAPAS,1.0,2552853,1997.0,,,,,,,,,0.0,,,Mexicana
Ricardo Alejandro Lopez Guajardo,"Lopez Guajardo,Ricardo Alejandro",3,7.0,Intelliswitch S.A. de C.V.,4,0,0,"Monterrey, MX",2012 - 2016,2012,2016,,Hombre,,,,,,,,,,,,,,,,,
Ricardo Benavides Perez,"Benavides Perez,Ricardo",3,3.0,Servicios Industriales Penoles S.A. De C.V.,6,0,0,"Monterrey, MX",1998 - 2009,1998,2009,21.0,HOMBRE,LICENCIATURA COMO INGENIERO QUÍMICO,UNIVERSIDAD AUTÓNOMA DE NUEVO LEÓN,1.0,4161365,1977.0,,,,,,,,,0.0,PEÑOLES,SUBDIRECTOR,Mexicana
Ricardo Cano,"Cano,Ricardo",3,15.0,OTIS ELEVATOR COMPANY,9,0,1,"Chihuahua, MX",2010 - 2023,2010,2023,,Hombre,,,,,,,,,,,,,,,,,
Ricardo Elizondo Costa,"Elizondo Costa,Ricardo",3,20.0,THE BOEING COMPANY,6,3,3,"San Luis Potosí, MX",2014 - 2016,2014,2016,,Hombre,,,,,,,,,,,,,,,,,
Ricardo Jimenez,"Jimenez,Ricardo",3,140.0,"Asterisk.Asterisk, LLC",7,0,3,"Mexico City, MX",2002 - 2020,2002,2020,,Hombre,,,,,,,,,,,,,,,,,
Ricardo Rey Diez,"Rey Diez,Ricardo",3,0.0,ORACLE INTERNATIONAL CORPORATION,6,0,3,"Zapopan, MX",2019 - 2020,2019,2020,6.0,HOMBRE,LICENCIATURA EN INGENIERÍA EN TECNOLOGÍAS ELECTRÓNICAS,INSTITUTO TECNOLÓGICO Y DE ESTUDIOS SUPERIORES DE MONTERREY,0.0,8298194,2013.0,,,,,,,,,0.0,EARNLN,SENIOR SOFTWARE ENGINEER,Mexicana
Ricardo Sanchez Ortega,"Sanchez Ortega,Ricardo",3,2.0,"Dynasol Elastómeros, S.A. de C.V.",5,0,0,"San Fernando, MX",2015 - 2016,2015,2016,24.0,HOMBRE,LICENCIATURA EN INGENIERÍA QUÍMICA,INSTITUTO TECNOLÓGICO DE CIUDAD MADERO (I.T.R.),1.0,1568490,1991.0,,,,,,,,,0.0,,,Mexicana
Roberto C Medellin,"C Medellin,Roberto",3,33.0,Roberto Gonzales Barrera,4,0,0,"Guadalupe, MX",1995 - 2017,1995,2017,,Hombre,,,,,,,,,,,,,,,,,
Roberto C Narro,"C Narro,Roberto",3,7.0,Aptiv Technologies AG,1,0,0,"Coahuila, MX",2019 - 2023,2019,2023,,Hombre,,,,,,,,,,,,,,,,,
Roberto Carrillo Fuentevilla,"Carrillo Fuentevilla,Roberto",3,26.0,Roberto Carrillo,1,0,0,"San Pedro Garza García, MX",2011 - 2016,2011,2016,8.0,HOMBRE,LICENCIATURA COMO CIRUJANO DENTISTA,UNIVERSIDAD AUTÓNOMA DE NUEVO LEÓN,1.0,4016696,2003.0,MAESTRÍA EN CIENCIA DE DATOS,UNIVERSIDAD DE GUANAJUATO,568,2016,,,,,1.0,,,Mexicana
Roberto Cruz,"Cruz,Roberto",3,16.0,Roberto Serrano Cruz,6,0,2,"General Escobedo, MX",2003 - 2017,2003,2017,,Hombre,,,,,,,,,,,,,,,,,
Roberto Flores Ortega,"Flores Ortega,Roberto",3,6.0,ADVANCE INTERNATIONAL INC.,4,0,3,"Mexico City, MX",2014 - 2017,2014,2017,,Hombre,,,,,,,,,,,,,,,,,
Roberto Miranda Guerrero,"Miranda Guerrero,Roberto",3,49.0,"Consorcio G. Grupo Dina, S.A. De C.V.",3,0,0,"Naucalpan, MX",2001 - 2002,2001,2002,,Hombre,,,,,,,,,,,,,,,,,
Roberto Morales,"Morales,Roberto",3,5.0,"PRODUCTOS Y SERVICIOS ESPECIALIZADOS M&M, S. DE R.",2,0,1,"Saltillo, MX",2017 - 2024,2017,2024,,Hombre,,,,,,,,,,,,,,,,,
Roberto Octaviano Flores Serrano,"Octaviano Flores Serrano,Roberto",3,53.0,"Hylsa, S.A. DE C.V.",5,0,0,"Monterrey, MX",1999 - 2002,1999,2002,11.0,HOMBRE,LICENCIATURA COMO INGENIERO QUÍMICO INDUSTRIAL,FUNDACIÓN UNIVERSIDAD DE LAS AMÉRICAS,0.0,1276589,1988.0,,,,,,,,,0.0,HYL TECHNOLOGIES,HEAD OF OPERATIONS,Mexicana
Roberto Olvera Camacho,"Olvera Camacho,Roberto",3,0.0,,0,0,0,"Tijuana, MX",2001 - 2002,2001,2002,,Hombre,,,,,,,,,,,,,,,,,
Roberto Ramirez Delgado,"Ramirez Delgado,Roberto",3,6.0,,0,0,0,"Jalisco, MX",1999 - 2008,1999,2008,12.0,HOMBRE,LICENCIATURA EN BIOLOGÍA ,INSTITUTO POLITÉCNICO NACIONAL,1.0,1206331,1987.0,,,,,,,,,0.0,,,Mexicana
Roberto Rodolfo Kretschmer Schmid,"Kretschmer Schmid,Roberto Rodolfo",3,8.0,"CBR, Inc.",0,0,0,"Pedregal, MX",2003 - 2009,2003,2009,39.0,HOMBRE,LICENCIATURA COMO MÉDICO CIRUJANO,UNIVERSIDAD NACIONAL AUTÓNOMA DE MÉXICO,1.0,103003,1964.0,,,,,,,,,0.0,,,Mexicana
Roberto Sonabend,"Sonabend,Roberto",3,2.0,Presencia en Medios SA de CV,1,0,0,"Querétaro, MX",2016 - 2017,2016,2017,,Hombre,,,,,,,,,,,,,,,,,
Rodolfo Flores Flores,"Flores Flores,Rodolfo",3,0.0,CENTRO DE INVESTIGACION EN QUIMICA APLICADA,10,2,1,"Tampico, MX",2009 - 2011,2009,2011,,Hombre,,,,,,,,,,,,,,,,,
Rodolfo Ramirez,"Ramirez,Rodolfo",3,63.0,Baker Hughes Holdings LLC,8,0,3,"Chihuahua, MX",2010 - 2023,2010,2023,,Hombre,,,,,,,,,,,,,,,,,
Rodrigo Alonso Galindo,"Alonso Galindo,Rodrigo",3,11.0,"INTEVA PRODUCTS, LLC",9,0,1,"Durango, MX",2016 - 2021,2016,2021,,Hombre,,,,,,,,,,,,,,,,,
Rodrigo Flores Maldonado,"Flores Maldonado,Rodrigo",3,136.0,The S. S. White Company,3,0,3,"El Pueblito, MX",2020 - 2021,2020,2021,2.0,HOMBRE,LICENCIATURA EN INGENIERÍA MECATRÓNICA,CENTRO DE ENSEÑANZA TÉCNICA INDUSTRIAL,1.0,10912299,2018.0,,,,,,,,,0.0,,,Mexicana
Rodrigo Lobeira Massu,"Lobeira Massu,Rodrigo",3,4.0,GRUMA S.A.B. DE C.V.,5,0,0,"Guadalupe, MX",2008 - 2021,2008,2021,14.0,HOMBRE,LICENCIATURA EN INGENIERÍA EN INDUSTRIAS ALIMENTARIAS,INSTITUTO TECNOLÓGICO Y DE ESTUDIOS SUPERIORES DE MONTERREY,0.0,1970137,1994.0,,,,,,,,,0.0,GRUMA,New Products Manager,Mexicana
Rogelio Fernando Gutierrez Valdes,"Gutierrez Valdes,Rogelio Fernando",3,2.0,International Business Machines Corporation,16,2,2,"Tlaquepaque, MX",2020 - 2022,2020,2022,,Hombre,,,,,,,,,,,,,,,,,
Rogelio Hernandez Suarez,"Hernandez Suarez,Rogelio",3,0.0,Instituto Mexicano del Petróleo,14,1,0,"Mexico City, MX",2018 - 2021,2018,2021,41.0,HOMBRE,LICENCIATURA EN INGENIERÍA QUÍMICA,UNIVERSIDAD NACIONAL AUTÓNOMA DE MÉXICO,1.0,447243,1977.0,MAESTRÍA EN CIENCIAS EN INGENIERÍA QUÍMICA,INSTITUTO POLITÉCNICO NACIONAL ,11604906,2019,DOCTORADO EN CIENCIAS ,UNIVERSIDAD AUTÓNOMA METROPOLITANA,11604817,2019,1.0,INSTITUTO MEXICANO DEL PETRÓLEO,INVESTIGADOR,Mexicana
Romeo Jesus Reyes Avila,"Reyes Avila,Romeo Jesus",3,7.0,Instituto Mexicano del Petróleo,14,0,0,"Mexico City, MX",2014 - 2019,2014,2019,26.0,HOMBRE,LICENCIATURA COMO INGENIERO INDUSTRIAL EN QUÍMICA,INSTITUTO TECNOLÓGICO DE OAXACA (I.T.R.),1.0,1238909,1988.0,,,,,,,,,0.0,,,Mexicana
Romualdo Segura Ruiz,"Segura Ruiz,Romualdo",3,5.0,"FÁBRICAS MONTERREY, S.A. DE C.V.",5,0,0,"El Control, MX",2016 - 2021,2016,2021,,Hombre,,,,,,,,,,,,,,,,,
Rosa N Gutierrez Aguilar,"Gutierrez Aguilar,Rosa N",3,1.0,International Business Machines Corporation,4,2,2,"Guadalajara, MX",2017 - 2021,2017,2021,,Mujer,,,,,,,,,,,,,,,,,
Rubi Elizabeth Triana Zorsano,"Triana Zorsano,Rubi Elizabeth",3,1.0,GE INFRASTRUCTURE TECHNOLOGY LLC,3,1,2,"Río Rico, MX",2022 - 2024,2022,2024,12.0,MUJER,LICENCIATURA EN INGENIERÍA MECÁNICA,UNIVERSIDAD POLITÉCNICA DE AGUASCALIENTES,1.0,6319263,2010.0,MAESTRÍA EN INGENIERÍA (MECÁNICA),UNIVERSIDAD AUTÓNOMA DE NUEVO LEÓN,11214965,2018,,,,,1.0,,,Mexicana
Salvador Iturbide Jimenez,"Iturbide Jimenez,Salvador",3,24.0,"Truper Herramientas, SA de CV",1,0,0,"Mexico City, MX",2006 - 2011,2006,2011,15.0,HOMBRE,LICENCIATURA EN INGENIERÍA MECÁNICA,UNIVERSIDAD AUTÓNOMA METROPOLITANA,1.0,1641651,1991.0,,,,,,,,,0.0,,,Mexicana
Salvador Valtierra Gallardo,"Valtierra Gallardo,Salvador",3,43.0,"Tenedora Nemak, S.A. de C.V.",3,0,0,"Coahuila, MX",1999 - 2001,1999,2001,19.0,HOMBRE,LICENCIATURA EN INGENIERÍA METALÚRGICA,UNIVERSIDAD AUTÓNOMA DE SAN LUIS POTOSÍ,1.0,632118,1980.0,MAESTRÍA EN METALURGIA,INSTITUTO POLITÉCNICO NACIONAL,,,DOCTORADO EN METALURGIA,UNIVERSIDAD DE SHEFFIELD,idk,,1.0,OWENS CORNING,DIRECCIÓN DE INNOVACIÓN,Mexicana
Samir Kumar Maity,"Kumar Maity,Samir",3,22.0,Instituto Mexicano del Petróleo,5,1,1,"Mexico City, MX",2015 - 2018,2015,2018,,Hombre,,,,,,,,,,,,,,,,,
Sara Trevino Garza,"Trevino Garza,Sara",3,0.0,ECOLAB USA INC.,10,0,3,"Santiago, MX",2019 - 2020,2019,2020,40.0,MUJER,LICENCIATURA EN CIENCIAS QUÍMICAS,UNIVERSIDAD DE MONTERREY,0.0,581252,1979.0,,,,,,,,,0.0,,,Mexicana
Saul Escobar,"Escobar,Saul",3,5.0,Grupo Gallegos,2,0,1,"Mexico City, MX",2019 - 2020,2019,2020,,Hombre,,,,,,,,,,,,,,,,,
Saulo David Cortes Cervantes,"Cortes Cervantes,Saulo David",3,4.0,"Ford Global Technologies, LLC",7,1,2,"Tlalnepantla, MX",2017 - 2017,2017,2017,,HOMBRE,LICENCIATURA COMO INGENIERO MECÁNICO ELECTRICISTA,INSTITUTO TECNOLÓGICO Y DE ESTUDIOS SUPERIORES DE MONTERREY,0.0,7946069,2013.0,,,,,,,,,0.0,,,Mexicana
Sebastian Rosas Contreras,"Rosas Contreras,Sebastian",3,1.0,"Ford Global Technologies, LLC",6,1,0,"Mexico City, MX",2022 - 2024,2022,2024,5.0,HOMBRE,LICENCIATURA COMO INGENIERO MECÁNICO,UNIVERSIDAD NACIONAL AUTÓNOMA DE MÉXICO,1.0,10241246,2017.0,,,,,,,,,0.0,,,Mexicana
Sergio Acosta,"Acosta,Sergio",3,3.0,ORACLE INTERNATIONAL CORPORATION,6,0,2,"Zapopan, MX",2021 - 2023,2021,2023,,Hombre,,,,,,,,,,,,,,,,,
Sergio Antonio Delon Canseco,"Delon Canseco,Sergio Antonio",3,3.0,ARRIS ENTERPRISES LLC,4,0,0,"Guadalupe, MX",2018 - 2022,2018,2022,9.0,HOMBRE,LICENCIATURA COMO INGENIERO MECÁNICO ADMINISTRADOR,UNIVERSIDAD REGIOMONTANA,0.0,5926604,2009.0,,,,,,,,,0.0,,,Mexicana
Sergio Cardoza,"Cardoza,Sergio",3,14.0,"ADC Telecommunications, Inc.",1,0,0,"Ciudad Juárez, MX",2005 - 2008,2005,2008,,Hombre,,,,,,,,,,,,,,,,,
Sergio Joaquin Gonzalez Flores,"Gonzalez Flores,Sergio Joaquin",3,1.0,"Skyworks Solutions, Inc.",5,0,3,"Mexicali, MX",2019 - 2021,2019,2021,12.0,HOMBRE,LICENCIATURA EN INGENIERÍA EN ELECTRÓNICA,UNIVERSIDAD AUTÓNOMA DE BAJA CALIFORNIA,1.0,5229464,2007.0,MAESTRÍA EN CIENCIAS DE LA INGENIERÍA,CENTRO DE ENSEÑANZA TÉCNICA Y SUPERIOR,9449945,2016,,,,,1.0,,,Mexicana
Sergio Moctezuma Espiricueto,"Moctezuma Espiricueto,Sergio",3,2.0,"Dynasol Elastómeros, S.A. de C.V.",5,0,0,"San Fernando, MX",2015 - 2016,2015,2016,,Hombre,,,,,,,,,,,,,,,,,
Sergio Moreno Linan,"Moreno Linan,Sergio",3,83.0,"Whirlpool Mexico, S.A. de C.V.",1,0,0,"Chicoloapan, MX",2004 - 2007,2004,2007,5.0,HOMBRE,LICENCIATURA EN DISEÑO INDUSTRIAL,UNIVERSIDAD AUTÓNOMA DE SAN LUIS POTOSÍ ,1.0,2896856,1999.0,,,,,,,,,0.0,,,Mexicana
Sergio Ramirez Amador,"Ramirez Amador,Sergio",3,0.0,Instituto Mexicano del Petróleo,9,0,0,"Mexico City, MX",2018 - 2018,2018,2018,35.0,HOMBRE,LICENCIATURA EN INGENIERÍA QUÍMICA,UNIVERSIDAD AUTÓNOMA METROPOLITANA,1.0,858462,1983.0,MAESTRÍA EN QUÍMICA,UNIVERSIDAD AUTÓNOMA METROPOLITANA,1814193,1993,,,,,1.0,,,Mexicana
Sergio Sanchez Garcia,"Sanchez Garcia,Sergio",3,0.0,"CORNING OPTICAL COMMUNICATIONS RF, LLC",1,1,0,"Reynosa, MX",2016 - 2018,2016,2018,,Hombre,,,,,,,,,,,,,,,,,
Sergio Serna Saldivar,"Serna Saldivar,Sergio",3,5.0,INSTITUTO TECNOLÓGICO Y DE ESTUDIOS SUPERIORES DE MONTERREY,5,2,0,"San Pedro Garza García, MX",2008 - 2013,2008,2013,,Hombre,,,,,,,,,,,,,,,,,
Serguei Miridonov,"Miridonov,Serguei",3,85.0,Centro de Investigacion Cientifica y Educación Superior de Ensenada,10,0,2,"Ensenada, MX",2004 - 2006,2004,2006,,,,,,,,,,,,,,,,,,,
Soraya C Mendoza,"C Mendoza,Soraya",3,2.0,Emerson Electric Co.,5,0,2,"San Antonio Tecómitl, MX",2018 - 2020,2018,2020,,Mujer,,,,,,,,,,,,,,,,,
Sven Mierswa,"Mierswa,Sven",3,1.0,"Bio Concept, LLC",0,0,0,"San Carlos, MX",2012 - 2015,2012,2015,,,,,,,,,,,,,,,,,,,
Swaminathan Iyer,"Iyer,Swaminathan",3,40.0,"Electrolux Home Products, Inc.",12,0,1,"Rayón, MX",2021 - 2022,2021,2022,,,,,,,,,,,,,,,,,,,
Tanya A Camacho Villegas,"A Camacho Villegas,Tanya",3,9.0,LABORATORIOS SILANES S.A. DE C.V.,6,1,1,"El Rosario, MX",2013 - 2017,2013,2017,8.0,MUJER,LICENCIATURA EN BIOLOGÍA,UNIVERSIDAD AUTÓNOMA DE BAJA CALIFORNIA,1.0,446720,2005.0,MAESTRÍA EN CIENCIAS CON ORIENTACIÓN EN BIOTECNOLOGÍA MARINA,CENTRO DE INVESTIGACIÓN CIENTÍFICA Y EDUCACIÓN SUPERIOR DE ENSENADA,11013818,2018,DOCTORADO EN CIENCIAS EN ECOLOGÍA MOLECULAR Y BIOTECNOLOGÍA ,UNIVERSIDAD AUTÓNOMA DE BAJA CALIFORNIA,11072023,2018,1.0,CIATEJ,INVESTIGADORA,Mexicana
Tara Sanzone,"Sanzone,Tara",3,5.0,"Ford Global Technologies, LLC",1,0,0,"Gustavo A. Madero, MX",2022 - 2023,2022,2023,,Mujer,,,,,,,,,,,,,,,,,
