Alfredo Cuevas Morales,"Cuevas Morales,Alfredo",6,,,,,,"San Luis Potosí, MX",2019 - 2024,2019,2024,26.0,Hombre,LICENCIATURA COMO DISEÑADOR INDUSTRIAL,UNIVERSIDAD AUTÓNOMA DE SAN LUIS POTOSÍ,1.0,1821433,1993.0,,,,,,,,,0.0,,,Mexicana
Alma Rosa Vazquez Gastellu,"Vazquez Gastellu,Alma Rosa",6,,,,,,"Tlaltizapan, MX",2007 - 2010,2007,2010,,Mujer,,,,,,,,,,,,,,,,,
Antonio Mendez,"Mendez,Antonio",6,,,,,,"Mexicali, MX",1984 - 2007,1984,2007,,Hombre,,,,,,,,,,,,,,,,,
Arturo Alberto Garcia Ramirez,"Garcia Ramirez,Arturo Alberto",6,,,,,,"Mexico City, MX",2020 - 2023,2020,2023,,Hombre,,,,,,,,,,,,,,,,,
Bernardo Baran,"Munoz Moya,Jose Antonio D",6,,,,,,"Tlalnepantla, MX",1994 - 2013,1994,2013,13.0,Hombre,LICENCIATURA EN ARQUITECTURA URBANISTA,UNIVERSIDAD IBEROAMERICANA,0.0,0663922,1981.0,,,,,,,,,0.0,,,Mexicana
Carlos Alberto Caballero De Ita,"Caballero De Ita,Carlos Alberto",6,,,,,,"Dolores Hidalgo, MX",2017 - 2022,2017,2022,4.0,HOMBRE,LICENCIATURA COMO INGENIERO MECÁNICO,UNIVERSIDAD DE GUANAJUATO,1.0,8065539,2013.0,MAESTRÍA EN INGENIERÍA EN AUTOMÁTICA,UNIVERSIDAD DE GUADALAJARA,134,2014,,,,,1.0,,,Mexicana
Carlos Arroyo Gonzalez,"Arroyo Gonzalez,Carlos",6,,,,,,"Juarez, MX",2002 - 2010,2002,2010,-2.0,Hombre,LICENCIATURA EN INGENIERÍA INDUSTRIAL EN ELÉCTRICA,INSTITUTO TECNOLÓGICO DE CIUDAD JUÁREZ (I.T.R.),1.0,4044193,2004.0,,,,,,,,,0.0,,,Mexicana
Celsa Mora Curiel,"Mora Curiel,Celsa",6,,,,,,"Juarez, MX",2002 - 2010,2002,2010,-1.0,Mujer,LICENCIATURA EN INGENIERÍA EN ELECTRÓNICA,INSTITUTO TECNOLÓGICO DE CIUDAD JUÁREZ (I.T.R.),1.0,4018293,2003.0,,,,,,,,,0.0,,,Mexicana
Claudia Santillan Figueroa,"Santillan Figueroa,Claudia",6,,,,,,"Jalisco, MX",2001 - 2002,2001,2002,-1.0,Mujer,LICENCIATURA EN INGENIERÍA INDUSTRIAL,INSTITUTO TECNOLÓGICO SUPERIOR DE EL MANTE,1.0,12368668,2002.0,,,,,,,,,0.0,,,Mexicana
Dan Nurko Elliot,"Nurko Elliot,Dan",6,,,,,,"Juarez, MX",2018 - 2022,2018,2022,2.0,HOMBRE,TÉCNICO SUPERIOR UNIVERSITARIO COMO PILOTO AVIADOR,"ACUERDOS SECRETARIALES 286, 328 Y 357 DE LA S.E.P.",0.0,10105758,2016.0,,,,,,,,,0.0,,,Mexicana
Daniel Esqueda,"Esqueda,Daniel",6,,,,,,"San Pedro, MX",2016 - 2022,2016,2022,,Hombre,,,,,,,,,,,,,,,,,
Daniel Francisco Gomez Romo,"Gomez Romo,Daniel Francisco",6,,,,,,"Sonora, MX",2017 - 2023,2017,2023,7.0,HOMBRE,LICENCIATURA EN INGENIERO EN MECATRÓNICA,INSTITUTO TECNOLÓGICO Y DE ESTUDIOS SUPERIORES DE MONTERREY,0.0,6507218,2010.0,,,,,,,,,0.0,,,Mexicana
Daniel Schmitz,"Schmitz,Daniel",6,,,,,,"Guadalajara, MX",2000 - 2022,2000,2022,,Hombre,,,,,,,,,,,,,,,,,
David Franco Lopez Rubio,"Lopez Rubio,David Franco",6,,,,,,"Lerma, MX",2020 - 2021,2020,2021,7.0,Hombre,LICENCIATURA EN INGENIERÍA MECATRÓNICA,UNIVERSIDAD POLITÉCNICA DE AGUASCALIENTES,1.0,7970462,2013.0,,,,,,,,,0.0,,,Mexicana
Diego Adrian Villarreal,"Adrian Villarreal,Diego",6,,,,,,"Monterrey, MX",2014 - 2020,2014,2020,0.0,HOMBRE,INGENIERIA MECÁNICA,UNIVERSIDAD AUTÓNOMA DE NUEVO LEÓN,1.0,8765432,2014.0,,,,,,,,,0.0,,,Mexicana
Edgardo Fabricio Ortiz Hernandez,"Ortiz Hernandez,Edgardo Fabricio",6,,,,,,"Estado de México, MX",2017 - 2019,2017,2019,20.0,Hombre,LICENCIATURA COMO INGENIERO MECÁNICO ELECTRICISTA,UNIVERSIDAD NACIONAL AUTÓNOMA DE MÉXICO,1.0,2484842,1997.0,,,,,,,,,0.0,,,Mexicana
Eduardo Valentin Arellano Guerra,"Arellano Guerra,Eduardo Valentin",6,,,,,,"Naucalpan, MX",2014 - 2015,2014,2015,16.0,Hombre,LICENCIATURA COMO INGENIERO QUÍMICO INDUSTRIAL,INSTITUTO POLITÉCNICO NACIONAL,1.0,2645015,1998.0,MAESTRÍA EN ADMINISTRACIÓN CON ESPECIALIDAD EN INGENIERÍA FINANCIERA,UNIVERSIDAD DEL VALLE DE MÉXICO,4093145,2003,,,,,1.0,,,Mexicana
Emilio Fuentes,"Fuentes,Emilio",6,,,,,,"Zapopan, MX",2014 - 2015,2014,2015,,Hombre,,,,,,,,,,,,,,,,,
Enrique Lopez Hernandez,"Lopez Hernandez,Enrique",6,,,,,,"Toluca, MX",2020 - 2023,2020,2023,,Hombre,,,,,,,,,,,,,,,,,
Fabiola Maria Teresa Torres Sanchez,"Torres Sanchez,Fabiola Maria Teresa",6,,,,,,"Hermosillo, MX",2014 - 2015,2014,2015,,Mujer,,,,,,,,,,,,,,,,,
Federico Jesus Jimenez Cruz,"Jimenez Cruz,Federico Jesus",6,,,,,,"Mexico City, MX",2013 - 2024,2013,2024,,Hombre,,,,,,,,,,,,,,,,,
Federico Perez Lecuona,"Perez Lecuona,Federico",6,,,,,,"Mexico City, MX",2017 - 2022,2017,2022,,Hombre,,,,,,,,,,,,,,,,,
Fernando Flores,"Flores,Fernando",6,,,,,,"Plan de Ayala, MX",1997 - 2024,1997,2024,,Hombre,,,,,,,,,,,,,,,,,
Francisco Javier Villanueva,"Javier Villanueva,Francisco",6,,,,,,"Cuauhtémoc, MX",2013 - 2019,2013,2019,,Hombre,,,,,,,,,,,,,,,,,
Gerardo Rodriguez Garay,"Rodriguez Garay,Gerardo",6,,,,,,"Chihuahua, MX",2010 - 2014,2010,2014,,Hombre,,,,,,,,,,,,,,,,,
Guillermo Centeno Nolasco,"Centeno Nolasco,Guillermo",6,,,,,,"Mexico City, MX",2010 - 2018,2010,2018,,Hombre,,,,,,,,,,,,,,,,,
Gustavo Jesus Marroquin Sanchez,"Marroquin Sanchez,Gustavo Jesus",6,,,,,,"Mexico City, MX",2010 - 2018,2010,2018,,Hombre,,,,,,,,,,,,,,,,,
Hernan Gutierrez,"Gutierrez,Hernan",6,,,,,,"Las Varas, MX",2000 - 2003,2000,2003,,Hombre,,,,,,,,,,,,,,,,,
Humberto Memetla Martinez,"Memetla Martinez,Humberto",6,,,,,,"Mexico City, MX",2019 - 2024,2019,2024,,Hombre,,,,,,,,,,,,,,,,,
Humberto Moreno,"Moreno,Humberto",6,,,,,,"Monterrey, MX",2018 - 2022,2018,2022,,Hombre,,,,,,,,,,,,,,,,,
Irving Hernandez,"Hernandez,Irving",6,,,,,,"Río Bravo, MX",2013 - 2023,2013,2023,,Hombre,,,,,,,,,,,,,,,,,
Ivan Fernandez,"Fernandez,Ivan",6,,,,,,"Granada, MX",1999 - 2020,1999,2020,,Hombre,,,,,,,,,,,,,,,,,
Jacob Froese Guenther,"Froese Guenther,Jacob",6,,,,,,"Cusihuiriachi, MX",1989 - 2020,1989,2020,,Hombre,,,,,,,,,,,,,,,,,
Jacob Neufeld,"Neufeld,Jacob",6,,,,,,"Riva Palacio, MX",1982 - 2023,1982,2023,,Hombre,,,,,,,,,,,,,,,,,
James H Siwicke,"H Siwicke,James",6,,,,,,"Monterrey, MX",2000 - 2001,2000,2001,,Hombre,,,,,,,,,,,,,,,,,
Javier Pena,"Pena,Javier",6,,,,,,"El Marqués, MX",2006 - 2022,2006,2022,,Hombre,,,,,,,,,,,,,,,,,
Jesus Alejandro Pena Casimiro,"Pena Casimiro,Jesus Alejandro",6,,,,,,"Naucalpan, MX",2017 - 2019,2017,2019,,Hombre,,,,,,,,,,,,,,,,,
Jesus Ernesto Meza,"Ernesto Meza,Jesus",6,,,,,,"Coahuila, MX",2020 - 2022,2020,2022,,Hombre,,,,,,,,,,,,,,,,,
Jesus Manuel Martinez Martinez,"Martinez Martinez,Jesus Manuel",6,,,,,,"Coahuila, MX",2014 - 2018,2014,2018,,Hombre,,,,,,,,,,,,,,,,,
Jetzabeth RAMIREZ SABAG,"RAMIREZ SABAG,Jetzabeth",6,,,,,,"Mexico City, MX",2012 - 2024,2012,2024,31.0,MUJER,LICENCIATURA EN INGENIERÍA CIVIL,UNIVERSIDAD NACIONAL AUTÓNOMA DE MÉXICO,1.0,654934,1981.0,,,,,,,,,0.0,,,Mexicana
Joaquin Alverde Trejo,"Alverde Trejo,Joaquin",6,,,,,,"Heroica Nogales, MX",2009 - 2012,2009,2012,,Hombre,,,,,,,,,,,,,,,,,
Joaquin Hernandez Diaz,"Hernandez Diaz,Joaquin",6,,,,,,"Naucalpan, MX",2014 - 2015,2014,2015,,Hombre,,,,,,,,,,,,,,,,,
Jonathan Tovar Balderas,"Tovar Balderas,Jonathan",6,,,,,,"Celaya, MX",2018 - 2022,2018,2022,,Hombre,,,,,,,,,,,,,,,,,
Jorge Bello,"Bello,Jorge",6,,,,,,"Tlapacoyan, MX",2002 - 2012,2002,2012,,Hombre,,,,,,,,,,,,,,,,,
Jorge F Paniagua Solis,"F Paniagua Solis,Jorge",6,,,,,,"Copoya, MX",2009 - 2017,2009,2017,,Hombre,,,,,,,,,,,,,,,,,
Jose Antonio Fosado Rodriguez,"Fosado Rodriguez,Jose Antonio",6,,,,,,"Santa Bárbara, MX",2023 - 2024,2023,2024,,Hombre,,,,,,,,,,,,,,,,,Mexicana
Jose Antonio Rodriguez Hernandez,"Rodriguez Hernandez,Jose Antonio",6,,,,,,"Mexico City, MX",1993 - 2013,1993,2013,,,,,,,,,,,,,,,,,,,Mexicana
Jose Cabello Fuentes,"Cabello Fuentes,Jose",6,,,,,,"San Fernando, MX",2002 - 2010,2002,2010,,Hombre,,,,,,,,,,,,,,,,,Español
Jose Escobar Aguilar,"Escobar Aguilar,Jose",6,,,,,,"Mexico City, MX",2008 - 2021,2008,2021,17.0,Hombre,LICENCIATURA COMO INGENIERO INDUSTRIAL QUÍMICO,INSTITUTO TECNOLÓGICO DE TUXTLA GUTIÉRREZ. (I.T.R.),1.0,1635569,1991.0,MAESTRÍA EN CIENCIAS EN TECNOLOGÍA DEL PETRÓLEO Y PETROQUÍMICA,INSTITUTO TECNOLÓGICO DE CIUDAD MADERO (I.T.R.),2329152,1996,DOCTORADO EN CIENCIAS,UNIVERSIDAD AUTÓNOMA METROPOLITANA,5607798,2008,1.0,,,Peruano
Jose Jaime Elizarraras,"Jaime Elizarraras,Jose",6,,,,,,"Jalisco, MX",2022 - 2022,2022,2022,,Hombre,,,,,,,,,,,,,,,,,Mexicana
Jose Jesus Reyes Soto,"Reyes Soto,Jose Jesus",6,,,,,,"San Luis Potosí, MX",2019 - 2024,2019,2024,11.0,HOMBRE,LICENCIATURA EN INGENIERÍA INDUSTRIAL Y DE SISTEMAS,UNIVERSIDAD INTERAMERICANA DEL NORTE,0.0,3108178,2008.0,MAESTRÍA EN ADMINISTRACIÓN,UNIVERSIDAD DEL VALLE DE MÉXICO,8087026,2013,,,,,1.0,,,Mexicana
Jose Ricardo Pena Zapata,"Pena Zapata,Jose Ricardo",6,,,,,,"Querétaro, MX",2019 - 2022,2019,2022,,Hombre,,,,,,,,,,,,,,,,,
Jose Salinas,"Salinas,Jose",6,,,,,,"Ndrea Kariou, MX",2002 - 2015,2002,2015,,Hombre,,,,,,,,,,,,,,,,,
Jose Torre,"Torre,Jose",6,,,,,,"Querétaro, MX",1998 - 2024,1998,2024,,Hombre,,,,,,,,,,,,,,,,,
Jose Odon Torres Quiroga,"Torres Quiroga,Jose Odon",6,,,,,,"Monterrey, MX",1996 - 2018,1996,2018,40.0,HOMBRE,LICENCIATURA EN INGENIERÍA QUÍMICA,INSTITUTO TECNOLÓGICO Y DE ESTUDIOS SUPERIORES DE MONTERREY,0.0,60657,1956.0,,,,,,,,,0.0,,,Boliviano
Juan Carlos Casarrubias,"Carlos Casarrubias,Juan",6,,,,,,"Mexico City, MX",2018 - 2023,2018,2023,30.0,HOMBRE,LICENCIATURA EN INGENIERÍA FORESTAL,INSTITUTO TECNOLÓGICO EL SALTO (I.T.FORESTAL NO. 1 DURANGO),1.0,1279733,1988.0,,,,,,,,,0.0,,,Mexicana
Juan Carlos Ortiz,"Carlos Ortiz,Juan",6,,,,,,"Juarez, MX",1996 - 2021,1996,2021,,,,,,,,,,,,,,,,,,,
Juan Francisco Garcia Cendejas,"Garcia Cendejas,Juan Francisco",6,,,,,,"San Miguel Ajusco, MX",2019 - 2023,2019,2023,8.0,HOMBRE,LICENCIATURA COMO INGENIERO MECÁNICO ADMINISTRADOR,INSTITUTO TECNOLÓGICO Y DE ESTUDIOS SUPERIORES DE MONTERREY,0.0,6899121,2011.0,MAESTRÍA EN INGENIERÍA AUTOMOTRÍZ,INSTITUTO TECNOLÓGICO Y DE ESTUDIOS SUPERIORES DE MONTERREY,8085523,2013,,,,,1.0,,,Mexicana
Juan Jose Wong,"Jose Wong,Juan",6,,,,,,"Coahuila, MX",2020 - 2024,2020,2024,20.0,HOMBRE,Ingenieria industrial en electronica,INSTITUTO TECNOLÓGICO DE PIEDRAS NEGRAS (I.T.R.),1.0,3222246,2000.0,,,,,,,,,0.0,ngeniero mecánico especializado en diseño automotriz,,Mexicana
Juan M Quintana,"M Quintana,Juan",6,,,,,,"Las Veredas, MX",2012 - 2022,2012,2022,,Hombre,,,,,,,,,,,,,,,,,
Juan Manuel A Vega,"A Vega,Juan Manuel",6,,,,,,"Zapopan, MX",2011 - 2021,2011,2021,,Hombre,,,,,,,,,,,,,,,,,Guatemalteco
Juan Pablo Senosiain Pelaez,"Senosiain Pelaez,Juan Pablo",6,,,,,,"Mexico City, MX",2014 - 2019,2014,2019,19.0,HOMBRE,LICENCIATURA COMO INGENIERÍA QUÍMICA Y DE SISTEMAS,INSTITUTO TECNOLÓGICO Y DE ESTUDIOS SUPERIORES DE MONTERREY,0.0,2141517,1995.0,,,,,,,,,0.0,,,Mexicana
Juan Pedro Baca Sanchez,"Baca Sanchez,Juan Pedro",6,,,,,,"Querétaro, MX",2019 - 2022,2019,2022,19.0,HOMBRE,LICENCIATURA EN DISEÑO INDUSTRIAL,UNIVERSIDAD AUTÓNOMA METROPOLITANA,1.0,3024970,2000.0,MAESTRÍA EN INNOVACIÓN PARA EL DESARROLLO EMPRESARIAL,INSTITUTO TECNOLÓGICO Y DE ESTUDIOS SUPERIORES DE MONTERREY,7142015,2011,,,,,1.0,,,Mexicana
Karen Manucharyan,"Manucharyan,Karen",6,,,,,,"Mexico City, MX",2010 - 2023,2010,2023,,Mujer,,,,,,,,,,,,,,,,,Armenio
Lorena Alvarez Contreras,"Alvarez Contreras,Lorena",6,0.0,"Centrode Investigacion en Materiales Avanzados, S.C.",8,0,0,"Chihuahua, MX",2012 - 2015,2012,2015,14.0,MUJER,LICENCIATURA EN INGENIERÍA QUÍMICA,UNIVERSIDAD MICHOACANA DE SAN NICOLÁS DE HIDALGO,1.0,2761178,1998.0,MAESTRÍA EN METALURGIA Y CIENCIAS DE LOS MATERIALES,UNIVERSIDAD MICHOACANA DE SAN NICOLÁS DE HIDALGO,3252776,2000,DOCTORADO EN CIENCIA DE MATERIALES,"CENTRO DE INVESTIGACIÓN EN MATERIALES AVANZADOS, S",4469720,2005,1.0,,,Mexicana
Luis Manuel Sanchez Aguilar,"Sanchez Aguilar,Luis Manuel",6,84.0,"ADC Telecommunications, Inc.",5 ,0,0,"Juarez, MX",2002 - 2010,2002,2010,,,,,,,,,,,,,,,,,,,
Luis Rafael Herrera Estrella,"Rafael Herrera Estrella,Luis",6,1829.0,Plant Genetic Systems N.V.,16,0,3,"Irapuato, MX",1998 - 2020,1998,2020,,Hombre,,,,,,,,,,,,,,,,,Mexicana
Luis Rodolfo Arevalo Pliego,"Arevalo Pliego,Luis Rodolfo",6,97.0,Colgate-Palmolive Company,6,1,1,"Juriquilla, MX",2013 - 2020,2013,2020,9.0,HOMBRE,LICENCIATURA EN DISEÑO INDUSTRIAL,UNIVERSIDAD ANÁHUAC,0.0,4042638,2004.0,,,,,,,,,0.0,,,Mexicana
Manuel Escamilla,"Escamilla,Manuel",6,4.0,"INTEVA PRODUCTS, LLC",8,0,1,"Chihuahua, MX",2011 - 2024,2011,2024,21.0,HOMBRE,LICENCIATURA EN INGENIERÍA MECÁNICA,INSTITUTO POLITÉCNICO NACIONAL,1.0,1504997,1990.0,,,,,,,,,0.0,,,Salvadoreño
Mario David Torres Cardona,"Torres Cardona,Mario David",6,134.0,"Industrial Organica, SA de CV",9 ,0,1,"El Control, MX",1993 - 2007,1993,2007,10.0,HOMBRE,LICENCIATURA COMO INGENIERO QUÍMICO BROMATÓLOGO,UNIVERSIDAD AUTÓNOMA DE CHIHUAHUA,1.0,827011,1983.0,MAESTRÍA EN CIENCIAS (QUÍMICA ORGÁNICA),UNIVERSIDAD AUTÓNOMA DE NUEVO LEÓN,1123048,1987,,,,,1.0,,,Colombiano
Miguel Rivas,"Rivas,Miguel",6,8.0,X Development LLC,6,0,3,"Tlalnepantla, MX",2016 - 2019,2016,2019,40.0,HOMBRE,LICENCIATURA COMO INGENIERO QUÍMICO INDUSTRIAL,INSTITUTO POLITÉCNICO NACIONAL,1.0,422855,1976.0,,,,,,,,,0.0,,,Mexicana
Narciso Delgado Guevara,"Delgado Guevara,Narciso",6,86.0,"ADC Telecommunications, Inc.",5,0,0,"Juarez, MX",2002 - 2010,2002,2010,,Hombre,,,,,,,,,,,,,,,,,Mexicana
Neyda Eliza Leon Lopez,"Leon Lopez,Neyda Eliza",6,3.0,Whirlpool Corporation,5,0,3,"Tanlu, MX",2021 - 2023,2021,2023,13.0,MUJER,LICENCIATURA EN INGENIERÍA EN ELECTRÓNICA Y CONTROL,UNIVERSIDAD REGIOMONTANA,0.0,5424586,2008.0,MAESTRÍA EN MECATRÓNICA,UNIVERSIDAD REGIOMONTANA,9623196,2015,,,,,1.0,,,Venezolana
Oscar Garza Ondarza,"GUZMAN CASTILLO,Maria de Lourdes Alejandra",6,80.0,"Tenedora Nemak, S.A. de C.V.",6,0,0,"El Control, MX",1998 - 2011,1998,2011,16.0,HOMBRE,LICENCIATURA COMO INGENIERO INDUSTRIAL ADMINISTRADOR,UNIVERSIDAD AUTÓNOMA DE NUEVO LEÓN,1.0,720147,1982.0,,,,,,,,,0.0,,,Mexicana
Osiris Mendoza Reyes,"Mendoza Reyes,Osiris",6,18.0,Sabritas S. de R.L. de C.V.,6 ,1,0,"Naucalpan, MX",2014 - 2015,2014,2015,,Hombre,,,,,,,,,,,,,,,,,Mexicana
Pedro E Hernandez,"E Hernandez,Pedro",6,85.0,JOHNSON MATTHEY PUBLIC LIMITED COMPANY,23,0,3,"Aguascalientes, MX",1988 - 2024,1988,2024,,Hombre,,,,,,,,,,,,,,,,,Hondureño
Ramon Naranjo Tackman,"Naranjo Tackman,Ramon",6,252.0,"Lensar, Inc.",3,0,1,"Mexico City, MX",2013 - 2023,2013,2023,31.0,HOMBRE,LICENCIATURA COMO MÉDICO CIRUJANO,UNIVERSIDAD AUTÓNOMA DE TAMAULIPAS,1.0,739169,1982.0,ESPECIALIDAD EN OFTALMOLOGÍA,CONSEJO MEXICANO DE OFTALMOLOGIA,3166718,2000,,,,,1.0,,,Mexicana
Ricardo Flores Lira,"Flores Lira,Ricardo",6,33.0,GES Technologies IP GmbH,1,1,0,"Monterrey, MX",2003 - 2009,2003,2009,24.0,HOMBRE,LICENCIATURA EN QUÍMICA INDUSTRIAL,UNIVERSIDAD AUTÓNOMA DE NUEVO LEÓN,1.0,589543,1979.0,MAESTRÍA EN CIENCIAS QUÍMICAS ESP. EN QUÍMICA ANALÍTICA,UNIVERSIDAD AUTÓNOMA DE NUEVO LEÓN,4161064,2004,,,,,1.0,,,Mexicana
Salvador Castillo Cervantes,"Castillo Cervantes,Salvador",6,2.0,Instituto Mexicano del Petróleo,15,0,0,"Mexico City, MX",2017 - 2020,2017,2020,32.0,HOMBRE,LICENCIATURA COMO INGENIERO QUÍMICO INDUSTRIAL,INSTITUTO POLITÉCNICO NACIONAL,1.0,957363,1985.0,,,,,,,,,0.0,,,Mexicana
Santiago Alonso Plata Amarillas,"Plata Amarillas,Santiago Alonso",6,1.0,MABE S.A. DE C.V.,6,0,0,"Querétaro, MX",2014 - 2019,2014,2019,16.0,HOMBRE,LICENCIATURA EN INGENIERO EN MECANICA,INSTITUTO TECNOLOGICO DE CULIACAN (ITM),1.0,2642534,1998.0,,,,,,,,,0.0,,,Mexicana
Santiago Manuel Parra Becerra,"Parra Becerra,Santiago Manuel",6,6.0,"Ford Global Technologies, LLC",7,0,1,"Ciudad del Carmen, MX",2017 - 2020,2017,2020,9.0,HOMBRE,Licenciatura como ingeniero mecánico electricista,INSTITUTO TECNOLÓGICO Y DE ESTUDIOS SUPERIORES DE MONTERREY,0.0,5727140,2008.0,,,,,,,,,0.0,,,Mexicana
Sergio Alberto Moctezuma Espiricueto,"Moctezuma Espiricueto,Sergio Alberto",6,30.0,"Dynasol Elastómeros, S.A. de C.V.",20,0,0,"Altamira, MX",2009 - 2023,2009,2023,20.0,HOMBRE,LICENCIATURA EN INGENIERÍA QUÍMICA,INSTITUTO TECNOLÓGICO DE CIUDAD MADERO (I.T.R.),1.0,1424046,1989.0,,,,,,,,,0.0,,,Mexicana
Sergio Antonio Delon Canseco,"Delon Canseco,Sergio Antonio",6,12.0,ARRIS ENTERPRISES LLC,6,0,0,"Apodaca, MX",2017 - 2023,2017,2023,8.0,HOMBRE,LICENCIATURA COMO INGENIERO MECÁNICO ADMINISTRADOR,UNIVERSIDAD REGIOMONTANA,0.0,5926604,2009.0,,,,,,,,,0.0,,,Mexicana
Terence Sean Yoo,"Sean Yoo,Terence",6,225.0,Steelcase Development Corporation,9,0,0,"Suchiapa, MX",2007 - 2013,2007,2013,,HOMBRE,Ingeniería biomédica,INSTITUTO TECNOLÓGICO Y DE ESTUDIOS SUPERIORES DE MONTERREY,0.0,,,,,,,,,,,0.0,,,Mexicana
Victoriano Zamora LEDEZMA,"Zamora LEDEZMA,Victoriano",6,76.0,Carrier Corporation,4,0,0,"El Control, MX",1999 - 2001,1999,2001,0.0,HOMBRE,LICENCIATURA COMO INGENIERO MECÁNICO ELECTRICISTA,UNIVERSIDAD AUTÓNOMA DE NUEVO LEÓN,1.0,2894681,1999.0,,,,,,,,,0.0,,,Mexicana
Adrian Sada Trevino,"Sada Trevino,Adrian",7,18.0,"Vitro Global, S.A.",1,0,0,"San Mateo del Mar, MX",2006 - 2010,2006,2010,,Hombre,,,,,,,,,,,,,,,,,
Alejandro Barrera Torres,"Barrera Torres,Alejandro",7,2.0,GM GLOBAL TECHNOLOGY OPERATIONS LLC,7 ,0,0,"Metepec, MX",2018 - 2022,2018,2022,24.0,HOMBRE,LICENCIATURA EN INGENIERÍA MECÁNICA,UNIVERSIDAD AUTÓNOMA METROPOLITANA,1.0,2043597,1994.0,MAESTRÍA EN SISTEMAS DE MANUFACTURA,INSTITUTO TECNOLÓGICO Y DE ESTUDIOS SUPERIORES DE MONTERREY,10341513,2017,DOCTORADO EN MANUFACTURA AVANZADA,"CIATEQ, A.C. CENTRO DE TECNOLOGÍA AVANZADA",12097605,2020,1.0,,,Mexicana
Alejandro Hernandez Covarrubias,"Hernandez Covarrubias,Alejandro",7,7.0,GM GLOBAL TECHNOLOGY OPERATIONS LLC,8 ,0,1,"Toluca, MX",2013 - 2023,2013,2023,-2.0,HOMBRE,LICENCIATURA EN INGENIERÍA EN PROCESOS Y OPERACIONES INDUSTRIALES,UNIVERSIDAD TECNOLÓGICA DE HUEJOTZINGO,1.0,9347693,2015.0,,,,,,,,,0.0,,,Mexicana
Aristeo Estrada Buendia,"Estrada Buendia,Aristeo",7,7.0,Instituto Mexicano del Petróleo,19,2,0,"Mexico City, MX",2014 - 2019,2014,2019,4.0,HOMBRE,LICENCIATURA EN GEOLOGÍA,UNIVERSIDAD PEDAGÓGICA NACIONAL (UPN),1.0,4567902,2010.0,MAESTRÍA EN INGENIERÍA QUÍMICA ADMINISTRATIVA,UNIVERSIDAD NACIONAL AUTÓNOMA DE MÉXICO,970,2019,,,,,1.0,,,Mexicana
Arturo Garcia Solis,"Garcia Solis,Arturo",7,29.0,GRUMA S.A.B. DE C.V.,2,0,0,"Guadalupe, MX",2017 - 2019,2017,2019,27.0,HOMBRE,LICENCIATURA COMO INGENIERO MECÁNICO ELECTRICISTA,UNIVERSIDAD AUTÓNOMA DE NUEVO LEÓN,1.0,1470897,1990.0,,,,,,,,,0.0,,,Mexicana
Aurelio De Gyves,"Jaramillo Jacob,Alicia del Rayo",7,388.0,John-Claude Savoir,6,0,0,"Coyoacán, MX",2001 - 2008,2001,2008,13.0,HOMBRE,Licenciatura como Químico Farmacéutico Biólogo,UNIVERSIDAD NACIONAL AUTÓNOMA DE MÉXICO,1.0,1263043,1988.0,,,,,,,,,0.0,EPIC Research CRO,Director de Asuntos Regulatorios,Mexicana
Carlos A Urquidi,"A Urquidi,Carlos",7,63.0,Delphi Technologies,4,0,1,"Juarez, MX",2005 - 2008,2005,2008,,Hombre,,,,,,,,,,,,,,,,,
CARLOS ARMANDO URQUIDI ALMODOVAR,"URQUIDI ALMODOVAR,CARLOS ARMANDO",7,63.0,Delphi Technologies,4,0,1,"Juarez, MX",2005 - 2008,2005,2008,4.0,HOMBRE,LICENCIATURA EN INGENIERÍA ELECTRÓNICA,INSTITUTO TECNOLÓGICO DE CIUDAD JUÁREZ (I.T.R.),1.0,3229426,2001.0,,,,,,,,,0.0,,,Mexicana
Carlos Fabian NAVA,"Fabian NAVA,Carlos",7,5.0,"Skyworks Solutions, Inc.",3,0,0,"Metepec, MX",2016 - 2023,2016,2023,,Hombre,,,,,,,,,,,,,,,,,Mexicana
Carlos Paul Gonzalez Inda,"Gonzalez Inda,Carlos Paul",7,42.0,ARRIS ENTERPRISES LLC,10,0,0,"Guadalupe, MX",2018 - 2023,2018,2023,19.0,HOMBRE,LICENCIATURA EN INGENIERÍA MECÁNICA,INSTITUTO TECNOLÓGICO DE CULIACÁN (I.T.R.),1.0,2965230,1999.0,,,,,,,,,0.0,,,Mexicana
Carolina Henonin,"Henonin,Carolina",7,29.0,Sabritas S. de R.L. de C.V.,0,0,0,"Mexico City, MX",2017 - 2019,2017,2019,,Mujer,,,,,,,,,,,,,,,,,
Cesar Garcia,"Garcia,Cesar",7,83.0,DEERE & COMPANY,7,0,2,"Monterrey, MX",2002 - 2022,2002,2022,,Hombre,,,,,,,,,,,,,,,,,Mexicana
David Aaron Nieto Alvarez,"Nieto Alvarez,David Aaron",7,12.0,Instituto Mexicano del Petróleo,23,0,0,"Mexico City, MX",2015 - 2021,2015,2021,24.0,HOMBRE,LICENCIATURA COMO QUÍMICO,UNIVERSIDAD NACIONAL AUTÓNOMA DE MÉXICO,1.0,1606232,1991.0,MAESTRÍA EN CIENCIAS QUÍMICAS (QUÍMICA ORGÁNICA),UNIVERSIDAD NACIONAL AUTÓNOMA DE MÉXICO,2399961,1997,DOCTORADO EN CIENCIAS EN CIENCIAS QUÍMICAS,CENTRO DE INVESTIGACIÓN Y DE ESTUDIOS AVANZADOS DE,4757653,2006,1.0,,,Mexicana
David Mondragon,"Mondragon,David",7,13.0,nVoq Incorporated,12 ,0,0,"Tepotzotlán, MX",2014 - 2023,2014,2023,-2.0,HOMBRE,LICENCIATURA COMO QUÍMICO FARMACÉUTICO INDUSTRIAL,INSTITUTO POLITÉCNICO NACIONAL,1.0,9732297,2016.0,,,,,,,,,0.0,,,Mexicana
Eduardo Garcia,"Garcia,Eduardo",7,20.0,UNITED STATES DEPARTMENT OF ENERGY,5 ,0,3,"Ecatepec, MX",1984 - 2013,1984,2013,,Hombre,,,,,,,,,,,,,,,,,
Erick Emanuel Luna Rojero,"Luna Rojero,Erick Emanuel",7,12.0,Instituto Mexicano del Petróleo,23,0,0,"Mexico City, MX",2015 - 2021,2015,2021,21.0,HOMBRE,Licenciatura en Física,UNIVERSIDAD AUTÓNOMA DE ZACATECAS FRANCISCO GARCÍA,1.0,2042276,1994.0,En Ciencias,Universidad Nacional Autónoma de México,2399968,1997,En Ingeniería,Universidad Nacional Autónoma de México,3969863,2003,1.0,Instituto Mexicano del Petróleo,Gerente de Ingeniería,Mexicana
Ernesto Castro,"Castro,Ernesto",7,101.0,LAMKIN CORPORATION,13,0,1,"Tijuana, MX",2000 - 2013,2000,2013,,Hombre,,,,,,,,,,,,,,,,,
Feliciano Guillen,"Guillen,Feliciano",7,65.0,LAMKIN CORPORATION,25,1,1,"Tijuana, MX",2012 - 2017,2012,2017,,Hombre,,,,,,,,,,,,,,,,,
Fernando Humberto Mercenari Uribe,"Mercenari Uribe,Fernando Humberto",7,83.0,"SHOP LATINO NETWORK, S. DE R.L. DE C.V.",1,0,0,"Mexico City, MX",2016 - 2022,2016,2022,20.0,HOMBRE,LICENCIATURA EN INGENIERÍA INDUSTRIAL,UNIVERSIDAD IBEROAMERICANA,0.0,2285810,1996.0,,,,,,,,,0.0,,,Mexicana
Gordon Thomas Quattlebaum,"Thomas Quattlebaum,Gordon",7,4.0,"MAIN ATTRACTIONS, LLC",0,0,0,"Quintana, MX",2012 - 2020,2012,2020,,Hombre,,,,,,,,,,,,,,,,,
Gustavo Garcia,"Garcia,Gustavo",7,184.0,"ADC Telecommunications, Inc.",26 ,0,3,"Chihuahua, MX",1987 - 2019,1987,2019,,Hombre,,,,,,,,,,,,,,,,,
Hector ARMENDARIZ HERRERA,"ARMENDARIZ HERRERA,Hector",7,7.0,Instituto Mexicano del Petróleo,15,2,0,"Mexico City, MX",2014 - 2019,2014,2019,32.0,HOMBRE,Ingeniería Industrial de Química,INSTITUTO TECNOLÓGICO DE CHIHUAHUA,1.0,774256,1982.0,En Ciencias de la tecnología del petróleo y petroquimica,Instituto Tecnológico de la Ciudad de Madero,1757247,1992,,,,,1.0,,,Mexicana
Hector Mendoza Orozco,"Mendoza Orozco,Hector",7,91.0,,0,0,0,"San Pablo Oztotepec, MX",1976 - 2004,1976,2004,16.0,HOMBRE,Licenciatura en Ingeniería mecánica ,"en el College of Applied Sciences de Detroit, Estados Unidos",0.0,,1960.0,,,,,,,,,0.0,Productos Mendoza,Presidente,Mexicana
Israel Cruz,"Cruz,Israel",7,59.0,"Hewlett-Packard Company, L.P.",10,0,1,"Zapopan, MX",2001 - 2024,2001,2024,,Hombre,,,,,,,,,,,,,,,,,
Jamil Nacif Benavides,"Nacif Benavides,Jamil",7,21.0,Rounderbum LLC,0,0,0,"Mexico City, MX",2019 - 2021,2019,2021,12.0,HOMBRE,LICENCIATURA EN ADMINISTRACIÓN DE EMPRESAS,UNIVERSIDAD DE LAS AMÉRICAS PUEBLA,0.0,5261889,2007.0,,,,,,,,,0.0,,,Mexicana
Javier Canales,"Canales,Javier",7,13.0,Coflex S.A. de C.V.,5,0,0,"Monterrey, MX",2014 - 2023,2014,2023,,Hombre,,,,,,,,,,,,,,,,,
Jesus Gabriel Trillo Vargas,"Trillo Vargas,Jesus Gabriel",7,4.0,International Business Machines Corporation,10 ,1,0,"Guadalajara, MX",2019 - 2023,2019,2023,-1.0,HOMBRE,Ingeniería Mecatronica,UNIVERSIDAD PANAMERICANA ,0.0,12092246,2020.0,En Finanzas,Universidad Panamericana,12168980,2020,,,,,1.0,,,Mexicana
Jorge Arturo Aburto Anell,"Aburto Anell,Jorge Arturo",7,0.0,Instituto Mexicano del Petróleo,26,0,0,"Mexico City, MX",2016 - 2020,2016,2020,22.0,HOMBRE,Químico en Alimentos,UNIVERSIDAD NACIONAL AUTÓNOMA DE MÉXICO,1.0,2031805,1994.0,,,,,,,,,0.0,Independiente,Profesional Independiente,Mexicana
Jorge Becerra,"Becerra,Jorge",7,112.0,Colgate-Palmolive Company,5,1,2,"Llano Grande, MX",2016 - 2020,2016,2020,,Hombre,,,,,,,,,,,,,,,,,
Jorge Mario Rochin Machado,"Rochin Machado,Jorge Mario",7,5.0,General Electric Company,21,0,3,"Querétaro, MX",2018 - 2024,2018,2024,10.0,HOMBRE,LICENCIATURA COMO INGENIERO MECÁNICO,INSTITUTO TECNOLÓGICO DE HERMOSILLO,1.0,5760985,2008.0,En Ciencias en Ingeniería Mecanica,Centro Nacional de Inventigacion y Desarrollo Tecn,7221541,2011,,,,,1.0,GE Vernova,Manager Ingeniero,Mexicana
Jose Eleazar Zuniga Juarez,"Eleazar Zuniga Juarez,Jose",7,12.0,Taoglas Group Holdings Limited,1,0,0,"Ensenada, MX",2014 - 2023,2014,2023,0.0,HOMBRE,LICENCIATURA EN INGENIERÍA EN ELECTRÓNICA,UNIVERSIDAD AUTÓNOMA DE BAJA CALIFORNIA,1.0,8763852,2014.0,,,,,,,,,0.0,,,Mexicana
Jose Gertrudis Bocanegra Rojas,"Bocanegra Rojas,Jose Gertrudis",7,7.0,"SERVICIOS ADMINISTRATIVOS PEÑOLES, S.A. DE C.V.",10,0,0,"Coahuila, MX",2014 - 2021,2014,2021,35.0,HOMBRE,LICENCIATURA COMO INGENIERO QUÍMICO INDUSTRIAL,INSTITUTO TECNOLÓGICO DE LA CIUDAD DE MADERO,1.0,549964,1979.0,En Ciencias En Comercialización de la Ciencia y la Tecnología,7239309,2011,,,,,,1.0,,,Mexicana
Jose Manuel Martinez Magadan,"Martinez Magadan,Jose Manuel",7,5.0,Instituto Mexicano del Petróleo,30 ,0,0,"Mexico City, MX",2016 - 2022,2016,2022,34.0,HOMBRE,LICENCIATURA COMO QUÍMICO,UNIVERSIDAD NACIONAL AUTÓNOMA DE MÉXICO,1.0,772296,1982.0,MAESTRÍA EN CIENCIAS QUÍMICAS (FÍSICO QUÍMICA),UNIVERSIDAD NACIONAL AUTÓNOMA DE MÉXICO,1728709,1992,DOCTORADO EN CIENCIAS QUÍMICAS,UNIVERSIDAD NACIONAL AUTÓNOMA DE MÉXICO,3512509,2001,1.0,,,Mexicana
Juan Angeles,"Angeles,Juan",7,388.0,John-Claude Savoir,3,0,0,"Puruándiro, MX",2001 - 2008,2001,2008,25.0,HOMBRE,LICENCIATURA COMO QUÍMICO FARMACÉUTICO BIÓLOGO,UNIVERSIDAD NACIONAL AUTÓNOMA DE MÉXICO,1.0,422876,1976.0,,,,,,,,,1.0,,,Mexicana
Juan Angeles,"Angeles,Juan",7,,,,,,"Puruándiro, MX",2001 - 2008,2001,2008,,,,,,,,,,,,,,,,,,,
Lawrence S Maccherone,"S Maccherone,Lawrence",7,119.0,Flexible Design Packaging Machine Company,6,0,3,"Puebla, MX",1979 - 2020,1979,2020,,,,,,,,,,,,,,,,,,,
Luis Ernesto Quiroz de la Mora,"Quiroz de la Mora,Luis Ernesto",7,9.0,"Continental Automotive Systems, Inc.",9 ,0,1,"Tlaquepaque, MX",2014 - 2021,2014,2021,6.0,HOMBRE,LICENCIATURA EN INGENIERÍA MECÁNICA,INSTITUTO TECNOLÓGICO Y DE ESTUDIOS SUPERIORES DE MONTERREY,0.0,5523997,2008.0,,,,,,,,,0.0,CEMEX,Operador de básculas,Mexicana
Makoto Fukubayashi,"Fukubayashi,Makoto",7,38.0,"Nissan Motor Co., Ltd.",13,0,3,"Licenciado Benito Juárez, MX",1991 - 2010,1991,2010,,,,,,,,,,,,,,,,,,,Japonés
